{
  "table_id": "treasury-mts/2026-07-table8-investments",
  "source": {
    "path": "sources/treasury-mts/mts-202607.pdf",
    "table": "Table 8. Trust Fund Impact — Securities Held as Investments",
    "page": 36,
    "title": "Table 8 Investments",
    "period": "July FY2026"
  },
  "unit_note": "USD millions. ...... omitted (Black Lung Disability and Military Advances investment columns all ...... dropped). Securities Held as Investments only.",
  "columns": [
    {
      "index": 1,
      "label": "Beginning of This Year"
    },
    {
      "index": 2,
      "label": "Close of Prior Month (This Month open)"
    },
    {
      "index": 3,
      "label": "Close of This Month"
    }
  ],
  "rows": [
    {
      "index": 1,
      "label": "Airport and Airway"
    },
    {
      "index": 2,
      "label": "Federal Disability Insurance"
    },
    {
      "index": 3,
      "label": "Federal Employees Life and Health"
    },
    {
      "index": 4,
      "label": "Federal Employees Retirement"
    },
    {
      "index": 5,
      "label": "Federal Hospital Insurance"
    },
    {
      "index": 6,
      "label": "Federal Old-Age and Survivors Insurance"
    },
    {
      "index": 7,
      "label": "Federal Supplementary Medical Insurance"
    },
    {
      "index": 8,
      "label": "Hazardous Substance Superfund"
    },
    {
      "index": 9,
      "label": "Highways"
    },
    {
      "index": 10,
      "label": "Military Retirement"
    },
    {
      "index": 11,
      "label": "Railroad Retirement"
    },
    {
      "index": 12,
      "label": "Unemployment"
    },
    {
      "index": 13,
      "label": "Veterans Life Insurance"
    },
    {
      "index": 14,
      "label": "All Other Trust"
    },
    {
      "index": 15,
      "label": "Total Trust Fund Investments Held from Table 6-D"
    }
  ],
  "cells": [
    {
      "id": "r1c1",
      "row": 1,
      "col": 1,
      "value": "18571",
      "role": "leaf"
    },
    {
      "id": "r1c2",
      "row": 1,
      "col": 2,
      "value": "21998",
      "role": "leaf"
    },
    {
      "id": "r1c3",
      "row": 1,
      "col": 3,
      "value": "22157",
      "role": "leaf"
    },
    {
      "id": "r2c1",
      "row": 2,
      "col": 1,
      "value": "215352",
      "role": "leaf"
    },
    {
      "id": "r2c2",
      "row": 2,
      "col": 2,
      "value": "253812",
      "role": "leaf"
    },
    {
      "id": "r2c3",
      "row": 2,
      "col": 3,
      "value": "255833",
      "role": "leaf"
    },
    {
      "id": "r3c1",
      "row": 3,
      "col": 1,
      "value": "81316",
      "role": "leaf"
    },
    {
      "id": "r3c2",
      "row": 3,
      "col": 2,
      "value": "82742",
      "role": "leaf"
    },
    {
      "id": "r3c3",
      "row": 3,
      "col": 3,
      "value": "83083",
      "role": "leaf"
    },
    {
      "id": "r4c1",
      "row": 4,
      "col": 1,
      "value": "1130982",
      "role": "leaf"
    },
    {
      "id": "r4c2",
      "row": 4,
      "col": 2,
      "value": "1124043",
      "role": "leaf"
    },
    {
      "id": "r4c3",
      "row": 4,
      "col": 3,
      "value": "1175879",
      "role": "leaf"
    },
    {
      "id": "r5c1",
      "row": 5,
      "col": 1,
      "value": "252906",
      "role": "leaf"
    },
    {
      "id": "r5c2",
      "row": 5,
      "col": 2,
      "value": "277926",
      "role": "leaf"
    },
    {
      "id": "r5c3",
      "row": 5,
      "col": 3,
      "value": "247805",
      "role": "leaf"
    },
    {
      "id": "r6c1",
      "row": 6,
      "col": 1,
      "value": "2400808",
      "role": "leaf"
    },
    {
      "id": "r6c2",
      "row": 6,
      "col": 2,
      "value": "2268181",
      "role": "leaf"
    },
    {
      "id": "r6c3",
      "row": 6,
      "col": 3,
      "value": "2246259",
      "role": "leaf"
    },
    {
      "id": "r7c1",
      "row": 7,
      "col": 1,
      "value": "153844",
      "role": "leaf"
    },
    {
      "id": "r7c2",
      "row": 7,
      "col": 2,
      "value": "191373",
      "role": "leaf"
    },
    {
      "id": "r7c3",
      "row": 7,
      "col": 3,
      "value": "135070",
      "role": "leaf"
    },
    {
      "id": "r8c1",
      "row": 8,
      "col": 1,
      "value": "11473",
      "role": "leaf"
    },
    {
      "id": "r8c2",
      "row": 8,
      "col": 2,
      "value": "11631",
      "role": "leaf"
    },
    {
      "id": "r8c3",
      "row": 8,
      "col": 3,
      "value": "11653",
      "role": "leaf"
    },
    {
      "id": "r9c1",
      "row": 9,
      "col": 1,
      "value": "68941",
      "role": "leaf"
    },
    {
      "id": "r9c2",
      "row": 9,
      "col": 2,
      "value": "57328",
      "role": "leaf"
    },
    {
      "id": "r9c3",
      "row": 9,
      "col": 3,
      "value": "54594",
      "role": "leaf"
    },
    {
      "id": "r10c1",
      "row": 10,
      "col": 1,
      "value": "1806919",
      "role": "leaf"
    },
    {
      "id": "r10c2",
      "row": 10,
      "col": 2,
      "value": "2117291",
      "role": "leaf"
    },
    {
      "id": "r10c3",
      "row": 10,
      "col": 3,
      "value": "2116107",
      "role": "leaf"
    },
    {
      "id": "r11c1",
      "row": 11,
      "col": 1,
      "value": "3523",
      "role": "leaf"
    },
    {
      "id": "r11c2",
      "row": 11,
      "col": 2,
      "value": "3668",
      "role": "leaf"
    },
    {
      "id": "r11c3",
      "row": 11,
      "col": 3,
      "value": "3940",
      "role": "leaf"
    },
    {
      "id": "r12c1",
      "row": 12,
      "col": 1,
      "value": "89394",
      "role": "leaf"
    },
    {
      "id": "r12c2",
      "row": 12,
      "col": 2,
      "value": "100139",
      "role": "leaf"
    },
    {
      "id": "r12c3",
      "row": 12,
      "col": 3,
      "value": "98753",
      "role": "leaf"
    },
    {
      "id": "r13c1",
      "row": 13,
      "col": 1,
      "value": "946",
      "role": "leaf"
    },
    {
      "id": "r13c2",
      "row": 13,
      "col": 2,
      "value": "769",
      "role": "leaf"
    },
    {
      "id": "r13c3",
      "row": 13,
      "col": 3,
      "value": "755",
      "role": "leaf"
    },
    {
      "id": "r14c1",
      "row": 14,
      "col": 1,
      "value": "39814",
      "role": "leaf"
    },
    {
      "id": "r14c2",
      "row": 14,
      "col": 2,
      "value": "40929",
      "role": "leaf"
    },
    {
      "id": "r14c3",
      "row": 14,
      "col": 3,
      "value": "40944",
      "role": "leaf"
    },
    {
      "id": "r15c1",
      "row": 15,
      "col": 1,
      "value": "6274791",
      "role": "total"
    },
    {
      "id": "r15c2",
      "row": 15,
      "col": 2,
      "value": "6551831",
      "role": "total"
    },
    {
      "id": "r15c3",
      "row": 15,
      "col": 3,
      "value": "6492831",
      "role": "total"
    }
  ],
  "relations": [
    {
      "type": "sum",
      "sources": [
        "r1c1",
        "r2c1",
        "r3c1",
        "r4c1",
        "r5c1",
        "r6c1",
        "r7c1",
        "r8c1",
        "r9c1",
        "r10c1",
        "r11c1",
        "r12c1",
        "r13c1",
        "r14c1"
      ],
      "target": "r15c1",
      "note": "trust investments roll-up col 1",
      "tol": "2",
      "why": "Table 8 footnote prints: \"Note: Details may not add to totals due to rounding.\""
    },
    {
      "type": "sum",
      "sources": [
        "r1c2",
        "r2c2",
        "r3c2",
        "r4c2",
        "r5c2",
        "r6c2",
        "r7c2",
        "r8c2",
        "r9c2",
        "r10c2",
        "r11c2",
        "r12c2",
        "r13c2",
        "r14c2"
      ],
      "target": "r15c2",
      "note": "trust investments roll-up col 2",
      "tol": "1",
      "why": "Table 8 footnote prints: \"Note: Details may not add to totals due to rounding.\""
    },
    {
      "type": "sum",
      "sources": [
        "r1c3",
        "r2c3",
        "r3c3",
        "r4c3",
        "r5c3",
        "r6c3",
        "r7c3",
        "r8c3",
        "r9c3",
        "r10c3",
        "r11c3",
        "r12c3",
        "r13c3",
        "r14c3"
      ],
      "target": "r15c3",
      "note": "trust investments roll-up col 3",
      "tol": "1",
      "why": "Table 8 footnote prints: \"Note: Details may not add to totals due to rounding.\""
    }
  ]
}
