{
  "table_id": "treasury-mts/2026-07-outlays-grand-total-capstone",
  "source": {
    "path": "sources/treasury-mts/mts-202607.pdf",
    "table": "Table 5. Outlays \u2014 Table 5 grand-total capstone (On/Off/Total Outlays)",
    "page": 23,
    "title": "Table 5 grand-total capstone (On/Off/Total Outlays)",
    "period": "July FY2026"
  },
  "unit_note": "USD millions. ...... and (**) cells omitted (not zero). Capstone: Total Outlays = Total On-Budget + Total Off-Budget per column.",
  "columns": [
    {
      "index": 1,
      "label": "This Month / Gross Outlays"
    },
    {
      "index": 2,
      "label": "This Month / Applicable Receipts"
    },
    {
      "index": 3,
      "label": "This Month / Outlays"
    },
    {
      "index": 4,
      "label": "Current FYTD / Gross Outlays"
    },
    {
      "index": 5,
      "label": "Current FYTD / Applicable Receipts"
    },
    {
      "index": 6,
      "label": "Current FYTD / Outlays"
    },
    {
      "index": 7,
      "label": "Prior FYTD / Gross Outlays"
    },
    {
      "index": 8,
      "label": "Prior FYTD / Applicable Receipts"
    },
    {
      "index": 9,
      "label": "Prior FYTD / Outlays"
    }
  ],
  "rows": [
    {
      "index": 1,
      "label": "Total Outlays"
    },
    {
      "index": 2,
      "label": "Total On-Budget"
    },
    {
      "index": 3,
      "label": "Total Off-Budget"
    }
  ],
  "cells": [
    {
      "id": "r1c1",
      "row": 1,
      "col": 1,
      "value": "825197",
      "role": "total"
    },
    {
      "id": "r1c2",
      "row": 1,
      "col": 2,
      "value": "58880",
      "role": "total"
    },
    {
      "id": "r1c3",
      "row": 1,
      "col": 3,
      "value": "766318",
      "role": "total"
    },
    {
      "id": "r1c4",
      "row": 1,
      "col": 4,
      "value": "6914848",
      "role": "total"
    },
    {
      "id": "r1c5",
      "row": 1,
      "col": 5,
      "value": "630612",
      "role": "total"
    },
    {
      "id": "r1c6",
      "row": 1,
      "col": 6,
      "value": "6284236",
      "role": "total"
    },
    {
      "id": "r1c7",
      "row": 1,
      "col": 7,
      "value": "6487563",
      "role": "total"
    },
    {
      "id": "r1c8",
      "row": 1,
      "col": 8,
      "value": "512409",
      "role": "total"
    },
    {
      "id": "r1c9",
      "row": 1,
      "col": 9,
      "value": "5975153",
      "role": "total"
    },
    {
      "id": "r2c1",
      "row": 2,
      "col": 1,
      "value": "695044",
      "role": "total"
    },
    {
      "id": "r2c2",
      "row": 2,
      "col": 2,
      "value": "51835",
      "role": "leaf"
    },
    {
      "id": "r2c3",
      "row": 2,
      "col": 3,
      "value": "643209",
      "role": "leaf"
    },
    {
      "id": "r2c4",
      "row": 2,
      "col": 4,
      "value": "5589798",
      "role": "total"
    },
    {
      "id": "r2c5",
      "row": 2,
      "col": 5,
      "value": "547473",
      "role": "leaf"
    },
    {
      "id": "r2c6",
      "row": 2,
      "col": 6,
      "value": "5042324",
      "role": "leaf"
    },
    {
      "id": "r2c7",
      "row": 2,
      "col": 7,
      "value": "5240116",
      "role": "total"
    },
    {
      "id": "r2c8",
      "row": 2,
      "col": 8,
      "value": "430458",
      "role": "leaf"
    },
    {
      "id": "r2c9",
      "row": 2,
      "col": 9,
      "value": "4809658",
      "role": "leaf"
    },
    {
      "id": "r3c1",
      "row": 3,
      "col": 1,
      "value": "130153",
      "role": "total"
    },
    {
      "id": "r3c2",
      "row": 3,
      "col": 2,
      "value": "7045",
      "role": "leaf"
    },
    {
      "id": "r3c3",
      "row": 3,
      "col": 3,
      "value": "123109",
      "role": "leaf"
    },
    {
      "id": "r3c4",
      "row": 3,
      "col": 4,
      "value": "1325050",
      "role": "total"
    },
    {
      "id": "r3c5",
      "row": 3,
      "col": 5,
      "value": "83139",
      "role": "leaf"
    },
    {
      "id": "r3c6",
      "row": 3,
      "col": 6,
      "value": "1241911",
      "role": "leaf"
    },
    {
      "id": "r3c7",
      "row": 3,
      "col": 7,
      "value": "1247447",
      "role": "total"
    },
    {
      "id": "r3c8",
      "row": 3,
      "col": 8,
      "value": "81952",
      "role": "leaf"
    },
    {
      "id": "r3c9",
      "row": 3,
      "col": 9,
      "value": "1165495",
      "role": "leaf"
    }
  ],
  "relations": [
    {
      "type": "sum",
      "sources": [
        "r1c3",
        "r1c2"
      ],
      "target": "r1c1",
      "note": "net identity: Outlays(net)+Applicable=Gross",
      "tol": "1",
      "why": "Table 5 footnote prints: \"Note: Details may not add to totals due to rounding.\" The footnote sits on page 23, Table 5's last page, and covers the whole table; it is not repeated on the section pages, so it must be read there. Components are independently rounded to $ millions, each carrying up to +/-0.5."
    },
    {
      "type": "sum",
      "sources": [
        "r1c6",
        "r1c5"
      ],
      "target": "r1c4",
      "note": "net identity: Outlays(net)+Applicable=Gross"
    },
    {
      "type": "sum",
      "sources": [
        "r1c9",
        "r1c8"
      ],
      "target": "r1c7",
      "note": "net identity: Outlays(net)+Applicable=Gross",
      "tol": "1",
      "why": "Table 5 footnote prints: \"Note: Details may not add to totals due to rounding.\" The footnote sits on page 23, Table 5's last page, and covers the whole table; it is not repeated on the section pages, so it must be read there. Components are independently rounded to $ millions, each carrying up to +/-0.5."
    },
    {
      "type": "sum",
      "sources": [
        "r2c3",
        "r2c2"
      ],
      "target": "r2c1",
      "note": "net identity: Outlays(net)+Applicable=Gross"
    },
    {
      "type": "sum",
      "sources": [
        "r2c6",
        "r2c5"
      ],
      "target": "r2c4",
      "note": "net identity: Outlays(net)+Applicable=Gross",
      "tol": "1",
      "why": "Table 5 footnote prints: \"Note: Details may not add to totals due to rounding.\" The footnote sits on page 23, Table 5's last page, and covers the whole table; it is not repeated on the section pages, so it must be read there. Components are independently rounded to $ millions, each carrying up to +/-0.5."
    },
    {
      "type": "sum",
      "sources": [
        "r2c9",
        "r2c8"
      ],
      "target": "r2c7",
      "note": "net identity: Outlays(net)+Applicable=Gross"
    },
    {
      "type": "sum",
      "sources": [
        "r3c3",
        "r3c2"
      ],
      "target": "r3c1",
      "note": "net identity: Outlays(net)+Applicable=Gross",
      "tol": "1",
      "why": "Table 5 footnote prints: \"Note: Details may not add to totals due to rounding.\" The footnote sits on page 23, Table 5's last page, and covers the whole table; it is not repeated on the section pages, so it must be read there. Components are independently rounded to $ millions, each carrying up to +/-0.5."
    },
    {
      "type": "sum",
      "sources": [
        "r3c6",
        "r3c5"
      ],
      "target": "r3c4",
      "note": "net identity: Outlays(net)+Applicable=Gross"
    },
    {
      "type": "sum",
      "sources": [
        "r3c9",
        "r3c8"
      ],
      "target": "r3c7",
      "note": "net identity: Outlays(net)+Applicable=Gross"
    },
    {
      "type": "sum",
      "sources": [
        "r2c1",
        "r3c1"
      ],
      "target": "r1c1",
      "note": "section roll-up col 1"
    },
    {
      "type": "sum",
      "sources": [
        "r2c2",
        "r3c2"
      ],
      "target": "r1c2",
      "note": "section roll-up col 2"
    },
    {
      "type": "sum",
      "sources": [
        "r2c3",
        "r3c3"
      ],
      "target": "r1c3",
      "note": "section roll-up col 3"
    },
    {
      "type": "sum",
      "sources": [
        "r2c4",
        "r3c4"
      ],
      "target": "r1c4",
      "note": "section roll-up col 4"
    },
    {
      "type": "sum",
      "sources": [
        "r2c5",
        "r3c5"
      ],
      "target": "r1c5",
      "note": "section roll-up col 5"
    },
    {
      "type": "sum",
      "sources": [
        "r2c6",
        "r3c6"
      ],
      "target": "r1c6",
      "note": "section roll-up col 6",
      "tol": "1",
      "why": "Table 5 footnote prints: \"Note: Details may not add to totals due to rounding.\" The footnote sits on page 23, Table 5's last page, and covers the whole table; it is not repeated on the section pages, so it must be read there. Components are independently rounded to $ millions, each carrying up to +/-0.5."
    },
    {
      "type": "sum",
      "sources": [
        "r2c7",
        "r3c7"
      ],
      "target": "r1c7",
      "note": "section roll-up col 7"
    },
    {
      "type": "sum",
      "sources": [
        "r2c8",
        "r3c8"
      ],
      "target": "r1c8",
      "note": "section roll-up col 8",
      "tol": "1",
      "why": "Table 5 footnote prints: \"Note: Details may not add to totals due to rounding.\" The footnote sits on page 23, Table 5's last page, and covers the whole table; it is not repeated on the section pages, so it must be read there. Components are independently rounded to $ millions, each carrying up to +/-0.5."
    },
    {
      "type": "sum",
      "sources": [
        "r2c9",
        "r3c9"
      ],
      "target": "r1c9",
      "note": "section roll-up col 9"
    }
  ]
}
